"name","year","id","type__001","type__002","type__003","rate","story","director__001","director__002","director__003","actor__001","actor__002","actor__003","actor__004"
"踩线","1981","3333979","剧情","","","6.6","本片是由著名演员王钟编导的社会写实电影。吕良伟与李修贤在片中均为中越混血儿，由越南逃至澳门；吕于香港出生，可在港居留，乃与李分散；郑则仕饰吕之叔父，为一干练警探，即介绍吕加入警界，派其作卧底。后郑一次与越南匪徒激斗中遭杀害；而李则被牵涉入这宗凶案……","王钟","","","李修贤","吕良伟","郑则仕","龙天生"
"失业生","1981","1470865","剧情","爱情","","7.1","电影讲述了阿荣（张国荣 饰）、家宝（陈百强 饰）和家辉（钟保罗 饰）三人追逐梦想的成长故事，阿荣、家宝、家辉是学校里同学好友，毕业后面对自己人生的道路各自做出了不同的决定。阿荣家境贫寒天生叛逆，经历了世间的种种磨难，与朋友的嫌隙也日渐消融。热爱音乐的家宝一心想要追求自己的梦想， 在不被家人理解后愤然出走，与阿荣等人打工赚钱并收获了纯净的爱情，最后被唱片公司发现做了自己的演唱会。玩世不恭的弟弟家辉选择了一条父母喜欢的道路，但也一直在背后默默支持者哥哥和朋友。这三个毕业又即失业的学生是怎样在这个梦想与现实激烈碰撞的毕业季中殊途同归的呢？©豆瓣","霍耀良","","","张国荣","陈百强","徐杰","邝美宝"
"赌王群英会","1981","3992537","剧情","","","6.6","宫本先生是日本的大企业家，在于潘董事长玩牌的过程中，下了一个高达500万美金，相当于2亿新币的赌注，众多董事支持潘董，以为潘董不会输给一个日本人，纷纷借钱给潘董，没想到，宫本先生赢了，将2亿元全都拿走。潘董破产，妻子一急之下撒手人寰。原来宫本先生是假，只是一个老千装扮。潘董面临众董事的逼债，只能求助于沙家的继承人与老千集团一斗……","程刚","","","胡慧中","凌云","杨惠姗","宗华"
"不准掉头","1981","1471799","喜剧","","","5.5","喜爱开快车的的士司机阿强（林嘉华），生日当天邂逅药房内的化装小姐阿玲（廖安丽），且误会其为妓女而有非分之想，后被收银员四眼妹（吴浣仪）逐出门外，至此，强方知是一场误会，遂向其道歉，玲感强之诚意乃答允他的邀约。\r\n    二人感情日增之时，玲之表哥占美（文方）自美返港，玲约强赴占美的宴会，令强大出洋相并愤然离去。当晚强因涉嫌非礼一舞小姐而被带返警署，引起玲之误会，不肯再见强。此时，占美介入二人之间，相处之下，玲觉得与占美颇有距离，更使她回味与强一起的乐趣。\r\n    强以为玲变心而终日茶饭不思，后得四眼妹鼓励而与占美斗车。比赛当日，强在终点前发生意外被送入医院，玲赶往医院时，只见众人伤心痛哭……","蔡继光","","","林嘉华","廖安丽","",""
"红粉动江湖","1982","1474440","动作","冒险","","6.8","本片為魯俊谷導演，由鐵漢陳觀泰與米雪、林秀君及楚湘雲三美女主演。故事描述，田思思（米雪）為富家女，嬌生慣養，刁蠻成性，喜武功，其父每斥資請武林高手與其交手，佯作打敗，田自感武功高強，其侍婢（林秀君）每日講述武林故事，談及高手秦歌（陳觀泰）瀟灑風流，萬夫莫敵，田為之心慕神往，忽聞其父將其許配與一名楊凡（元德）者，心有不甘，乃與婢女扮男裝，夤夜出走，尋訪秦歌……","鲁俊谷","","","陈观泰","米雪","林秀君","元德"
"乌龙天师招积鬼","1982","24827634","动作","","","0","When a petty criminal hires a priest to raise the dead in order to get revenge on the man who put him in prison, it backfires and all manner of black magic mayhem ensues as ghosts, zombies, and a bloodsucking super fighter wreck havoc.\nMondo martial arts mayhem on a grand scale is the best description for this incredibly over-the-top comedy/horror hybrid starring cult sensation Billy Chong. Imagine Sam Raimi’s Evil Dead II (1987) without Bruce Campbell or his one-liners, but with twice the insane momentum and of course, kung fu.\nBilly Chong plays Pan Fong, a martial artist trained by his verbally abusive father to prepare for the worst. Earlier, Fong foiled a heist (as told in a Keystone Cops-style flashback) and now the criminal in charge wants revenge. He hires Chan Lau, who plays quite possibly his best role as a priest who dabbles in black magic. Lau’s job is to get several zombies he raised to push Fong into a deathtrap. Only trouble is that the criminal ends up dead in his own trap. His spirit rises to force Lau to find him another body. This leads to them attempting to transfer his soul into the body of a vicious killer named Long (so named for the length of his fights) after Fong kills him at the end of a grueling three hour fight. This also backfires and only awakens an evil within the killer who has now returned as an unstoppable, bloodsucking fiend. One last attempt by Lau to transfer the criminal’s spirit into the body of Fong’s recently deceased father is only partially successful. The criminal and the bloodsucker join forces to kill Fong, but he’s got his kung fu skills, Priest Lau, and a Buddhist monk on his side.\nIts simple. People are generally going to love Kung Fu Zombie or hate it. Technically, the action is undercranked in the extreme, resulting in extraordinarily speedy fighting. Cuts are rapid and the action incorporates lots of wirework and trick editing. There is tons of kung fu fighting and its fun, but hard to follow. The pace of the film is intense and never lets up, even with the humor which is definitely low brow, even more so than Yuen Wo Ping’s Shaolin Drunkard (1983) or Sammo Hung’s Encounter of a Spooky Kind (1980). Expect to revel in drunkenness, a lot of female fondling and a low regard for death.\nSeveral highlights mark this film as a cut above the standard independent releases of the era. One is Billy Chong’s performance which is charismatic and intense. His physical and acting performance fits the role perfectly. His love-hate relationship with his father may not be the model for good family living, but it’s a refreshing twist and ties back nicely into the story later when the criminal inhabits the father’s body. Chan Lau who is well known among fans for his many comical roles he plays in films, usually as the villain really gets to ham it up this time. As the well-meaning and cowardly priest who starts all the trouble, he’s forced along as events spiral out of control. He ends up drunk, stumbling about at night and mumbling about sticking to weddings when an entire mob of zombies, probably from past jobs that were botched rear up behind him. It’s a fitting end.\nIt’s my guess that Sam Raimi must have seen this film before beginning his Evil Dead series. The tracking camera shots and sheer insanity with which the filmmakers unleash their scenes, even the non-fight scenes are deliciously wild and entertaining. There are a few scenes that don’t connect well with the story (possibly due to cuts made to the original print), but overall the story is surprisingly cohesive for an old school title.\nFor outrageous kung fu action with a healthy dose of uncultured and comical horror, Kung Fu Zombie provides a rotting good time.\nBy Mark Pollard -kungfucinema.com-","华山","","","庄泉利","","",""
"另女正传","1981","3715221","喜剧","爱情","","5.5","由呂奇導演的艷情片《叻女正傳》，體現新女性大膽追求財富和愛情的經過。兩大性感女星艾蒂、凌黛，分別飾演姊妹花帶金、帶銀。兩人憑誘人姿色、魅力，在情場、職場闖天下。帶金做香煙女郎，其美貌得廣告公司經理賈忠誠 (羅浩楷)看中，一躍成為公關經理，重要職責竟是以美色迷惑億萬富翁周小福（鄭君綿），將其代理的香煙廣告盡交給他們代理。帶銀則迷戀花花公子趙元崇 (羅石青)，一夜失身後，竟樂意到他家當傭人，惜趙元崇花心個性未改，帶銀珠胎暗結，他也無動於衷。兩姊妹幾經事業、愛情波折，終明白愛情真義。","吕奇","","","艾蒂","罗石青","凌黛","邵音音"
"知法犯法","1981","20433155","剧情","动作","犯罪","0","金岳泰与金世昌兄弟二人，专门打劫开赌场及印制伪钞，做案计划周详，不留破绽，警方也无可奈何。一次警方得知金岳泰与另一黑社会头子上海张合作制伪钞，而多个打劫及开赌计划同时进行，警方为免打草惊蛇，先派干探李策民作卧底，搜集所有犯罪证据，李策民与女友及杰仔暗中进行活动，千辛万苦，身入虎穴搜集证据，最后为金世昌识破，枪伤杰仔及挟持李策民女友做人质。","萧荣","","","邓光荣","陈惠敏","余绮霞",""
"千门八将","1981","1469669","动作","犯罪","冒险","6.3","尽窥赌术内幕的影片《千门八将》讲述，正将（张瑛饰）是道上叱咤风云的“赌王”，其精湛的赌术使得他成为赌界的王中王。一次，他在与“赌魔”（罗烈饰）的赌局中，被其暗算而隐恨退出江湖。二十年后，赌魔以计迫使正将重出赌坛，与其再赌一次，以证明自己在赌界的地位。正将被赌魔以千术击败，含怨吐血而亡。 \r\n  正将之子（刘永饰）为报父仇，不惜走出险招，利用自身英俊不凡的处表施展美男计，引诱财魔的继室（楚湘云饰）中其圈套。与此同时，他邀其请昔日与其父亲出生入死的拍档“千门八将”（陈观泰、王晶等饰）与赌魔展开连场赌博，最终得以报仇雪恨。 \r\n  讲开『赌』片，令人印象最深刻是1989年由周润发主演的《赌神》，片中赌神大嚼朱古力挫败对手的一幕堪称经典，同时也掀起了90年代的赌片风潮，一时间赌圣、赌侠都横空出世，事实上，《千门八将》可说是80年代初的《赌神》。 \r\n  王晶编剧的赌术,可谓已经在八十年代开创先河,非常不错,总是在紧张的气氛下还有诙谐搞笑一面.使人也看得轻松,比起其它邵氏影片,就当调节也算不错.赌术片虽然不喜欢,不过以前一直看,也不算太讨厌,能够看得进去,情节紧张刺激,节奏快,王晶的赌片一直延袭到九十年代,很厉害……","孙仲","","","刘永","陈观泰","罗烈","艾飞"
"单程路","1981","2345997","冒险","剧情","","6","本片由金馬影帝李修賢自導自演，是一部80年代初「烈火戰車」式的賽車片。故事描述跛足之摩托車行東主師傅才（李修賢），對學徒阿昌（麥德羅）甚為賞識，更在每年一度的澳門賽車，助昌奪標。後知師傅才曾是東南亞十大車手之一，因一次賽車意外受傷導致殘廢。師傅才聞悉昌參與非法賽車，忙予規勸，然昌因盛名所累，欲罷不能……","李修贤","蓝乃才","","李修贤","麦德罗","戴良纯","尹志强"
"血鹦鹉","1981","2356969","动作","恐怖","惊悚","6.8","本片由古龍原著，倪匡改編劇本，華山執導。故事講述據說幽冥中諸魔用魔血化成了血鸚鵡，只要你能看見它，就會有三個願望。江湖俠盜葉停楓(白彪 飾)與其他高手一樣，一直在追尋血鸚鵡的真相；而中原名捕「鐵手無情」鐵恨(劉永 飾)，則對王府一夜之間突告失竊的十三箱珠寶緊緊追查。一夜，葉、鐵二人在墳場相遇，血鸚鵡突告出現，鐵死於它的魔力之下……","华山","","","白彪","刘永","梁珍妮","顾冠忠"
"尸妖","1981","2156696","犯罪","恐怖","悬疑","6.4","广州地方上搬来了一对儿怪异情侣，他们居住的荒僻院落绝少有人出入且传出恶臭，不堪忍受的邻居们破门而入，发现此时已不见踪影的李姓男子居然奸尸。广州警察总局刑侦处张处长（王戎 饰）为调查奸尸案前往佛山，始知两年前当地富家公子李正元（陈家奇 饰）从醉红轩兰姑（恬妮 饰）手中买下重病妓女红眉，在红眉去世后奸尸多日，案发后被关入疯人院。张处长料想最近的奸尸案亦为李正元所做，而李家祖宅内的新女尸和被刺死的巡警证明李正元已经返回佛山。不久张处长发现李正元似乎有意针对醉红轩的妓女下手，经调查发现兰姑曾经从李正元手中诈骗巨款。而此时，获悉李正元从疯人院出院消息的兰姑等人惶惶不可终日……©豆瓣","桂治洪","","","恬妮","王戎","尤翠玲","陈家奇"
"胆搏胆","1981","20443012","动作","","","0","One means to encourage a blood-thirst in routinely staid viewers is to create victims that could be one of them, and then finish off the victim in the most repulsive manner possible. To that end, Revenge in Hong Kong first shows how the son of a super-rich Hong Kong businessman is a disgusting combination of voyeur and sadomasochist, hiding his weird afflictions from the world. Next, the happy, middle-class life of a lawyer and his loving wife (Eva Ling), and the lawyer's police detective friend (Stephen Leung) is shown in all its idyllic routine. Then the innocent wife witnesses the sadomasochist kill a woman, and testifies in court to his guilt. In revenge, the son's wealthy father hires the scum of Hong Kong to murder the wife, raping her beforehand. That deed sets off the next revenge sequence, as the husband and his police buddy run amok, gangsters run amok, and the blood runs all over the place as well.","張同祖","","","嘉倫","黃錦燊","呂良偉","江道海"
"书剑恩仇录","1981","1794491","动作","武侠","古装","6.1","乾隆年间，国泰民安，然此时反清势力也甚为活跃。反清帮会红花会第四把交椅文泰来（邓伟豪 饰）和妻子骆冰（陈琪琪 饰）被朝廷鹰爪困在三道沟，经武当派名宿陆菲青（王戎 饰）的引荐前往名震西北的老英雄周仲英（谷峰 饰）的铁胆庄避难。与此同时，陆菲青的师弟、效力朝廷的张召重（罗烈 饰）尾随而至，以重兵要挟铁胆庄交出文泰来。虽然文藏身暗道，却被张诱骗周仲英年幼的儿子指出文等人的藏身所在。骆冰和余雨同（顾冠忠 饰）侥幸逃出，路遇红花会总舵主陈家洛（狄龙 饰），众人一同返回铁胆庄。与此同时，外出归来的周仲英得知庄内的变故，愤而打死自己的儿子。经过一番拚斗，铁胆庄与红花会消除误会，冰释前嫌，周亦带着女儿随红花会同行营救文泰来……\n本片根据武侠小说作家金庸的同名原著改编。©豆瓣","楚原","","","狄龙","白彪","艾飞",""
"飞刀’又见飞刀","1981","2003648","动作","犯罪","剧情","5.4","一心要为父报仇的孤独求败，欲杀李寻欢，月神也唆使寻欢之子李坏去杀寻欢，但李寻欢揭穿了恶人的阴谋，父子相认，合力将恶人杀死。","黄泰来","","","姜大卫","张天爱","徐少强","仓田保昭"
"死亡塔","1981","1784747","动作","悬疑","","6.8","一代宗师李振强（李小龙 饰）和武林高手秦谷（黄正利 饰）是生死之交，秦谷的莫名死亡让李振强决心找到背后的真凶。哪知道在这过程中，李振强不幸遇害，只留下了一个和死亡塔有关的秘密，没有人能够解开。\n振国（金泰中 饰）是李振强的弟弟，得知哥哥的死讯，闭关修炼多年的振国决定下山，为兄寻仇。追随着李振强留下的线索，振国来到了神秘的山庄之中，经历了诸多生死攸关的险情，并最终打开了秘密通道，来到了潜藏在山庄之下的宫殿之中。在这里，等待着他的竟然是正是秦谷，振强和振国都落入了他一手策划的阴谋漩涡之中。秦谷想要将振国杀死毁尸灭迹，遭到了后者的奋起反击。©豆瓣","吴思远","洪金宝","元奎","李小龙","乔宏","黄正利","李海生"
"射雕英雄传三集","1981","1301908","武侠","古装","","6.5","正所谓江湖险恶，险象环生。东邪黄药师之女黄蓉（妞妞 饰）被铁掌帮帮主裘千仞所伤，危在旦夕。郭靖（傅声 饰）背负蓉儿一路逃亡，偶然机缘行至一个机关密布的所在，并在此结识了深居简出的神算子瑛姑。在瑛姑的指点下，二人前往桃源寻找南帝段智兴（狄龙 饰）。桃源风景秀丽，鸟语花香，然一派祥和之下危机四伏，更有“渔樵耕读”四大高手阻挡去路。郭靖和蓉儿凭借高超的武功和过人的机敏闯过重重难关，终于见到已剃度出家的段王爷。段王爷虽知出手相救的凶险，却仍用一阳指治愈蓉儿，更道出了与瑛姑那一段鲜为人知的爱怨情仇……\n本片根据金庸同名武侠小说改编。©豆瓣","张彻","","","傅声","郭佑华","狄龙","井莉"
"串女人渣沙娇娃","1981","26284572","喜剧","","","0","","吕奇","","","艾蒂","Li-Li Chen","郑君绵","Han-chen Hsieh"
"新强奇趣录","1981","1298377","动画","奇幻","冒险","7.6","只要有处在青春期脑子里面整天都是性幻想的少男存在，这部片子就不愁没有观众。 这部在1981年上映的影片是根据同名图片杂志改编的（当然是一本最大限度激发了想象力和“自慰”本能的杂志），也同时成为Columbia/TriStar's公司作品中最响亮的名字。不同的人有着截然不同的评论，一是专业的成年评论者，他们认为这部动画片就是抓住了特定人群的心理，利用炫目奇幻的特点吸引年轻族群，招来全世界上百位动画技师但也没有任何革命性的创新出现。但是相反躁动的年轻人可不这样看，影片上映在80年代初期，刚刚经历完70年代美国思潮的年轻人们急欲找到能够释放的渠道，深夜观看这部片子也许就是他们最大的慰籍...","杰拉德·伯特顿","","","罗德格尔·邦帕斯","约翰·坎迪","杰姬·布罗斯",""
"顶爷","1981","5050962","动作","","","0","","Tso Nam Lee","","","王冠雄","柯俊雄","陈鸿烈","楊群"
"绿印","1981","26722062","动作","","","0","两个星期内发生了12起凶杀案，死者都是年轻的妓女，当警察有了一些线索的时候，凶手又把王警官的女友当成了下一个目标，王警官为了报女友的仇，发誓要缉拿凶手归案….","罗道邦","","","陈惠敏","黄家达","吕小龙","陈莉莉"
"猫头鹰","1981","1871997","喜剧","动作","武侠","7.7","长期带着头套的神秘猫头鹰公子，是猫头鹰帮的主脑并主持一个地下拍卖会，在拍卖会现场，猫头鹰公子的黑奴、洋妞、蒙娜丽莎画作等拍品遭到客人的鄙视，对方指定要买皇帝的第36房妃子，于是猫头鹰公子派出大盗大钢牙将36房妃掳来。气急败坏的皇帝派将军寻人不成，只好遣能言鹦鹉寻找到御前侍卫后人范士林（姜大卫 饰）接下任务。范士林联络小李飞刀传人小小李（卫子云 饰）、小鱼儿后人大白鲨（曾志伟 饰）踏上寻妃旅程。同时，猫头鹰公子一方派出忍者（秦沛 饰）阻碍他们的行动。范士林三人与沈胜义（徐少强 饰）、唐门小姐等接洽后渐渐逼近猫头鹰公子，无厘头大战一触即发……©豆瓣","姜大卫","","","姜大卫","曾志伟","秦沛","徐少强"
"兵兵贼贼","1981","3574524","剧情","犯罪","","0","警长徐进享因尊重妻子之意，遂放弃其充满刺激性的警务工作，转而经营一间财务公司，以为从此可以过着安宁愉快的生活，但人算不如天算，竟被牵连于一宗炸弹案中。\n事发时，徐进与妻子及儿子一同逛公司，当徐往洗手间之际，其妻儿被一个不明来历的计时炸弹所伤，徐则幸然无恙。\n梁家伦是一位机警能干的警官，是徐之大舅，未婚，与徐一家同住，他得悉妹妹被炸弹所伤，便马上赶往医院探望，但其妹伤势颇为严重，一直昏迷不醒……","何康铭","","","徐少强","黄敏仪","嘉伦",""
"父子情","1981","1302988","剧情","家庭","","7.6","老人罗山木（石磊 饰）收到儿子罗家兴在美国毕业归来的信息，多年夙愿得偿，却因为心脏病突发与世长辞。家兴回国来家中看望，回忆起父亲对自己的教诲深感愧疚遗憾。原来，家兴（李羽田 饰）自幼顽皮，胸无大志，梦想是在戏院作领位，遭人讥笑。而父亲罗山木因为学历底下，虽然在银行勤勤恳恳，却始终难得升迁，因此他希望儿子不要步自己后尘，所以对他严加管教，希望可以出人头地。家兴少不更事，完全不懂父亲苦心，只知道与邻家男孩厮混，两人翘课看戏，屡屡犯禁，闯祸无数，最终连续5次被退学，却依旧玩心不死。他高考落榜，背着父亲去考艺校，令老人极为失望。最终，罗山木做出了一个极为艰难的决定，这场命运的交易也最终让家兴开始发奋读书……\n本片获得第1届香港电影金像奖最佳影片，方育平摘得最佳导演。©豆瓣","方育平","","","石磊","朱虹","容惠雯","卢大伟"
"领野","1981","25909628","剧情","动作","","0","Three women captured and imprisoned by a gang of white slavers lead a bloody rebellion, aided by a detective investigating the gang.What a find! It’s a bizarre, over-the-top HK women in prison flick. The cast is a surprisingly multi-ethnic mix of east asianers. A martial arts expert of debatable talent helps them after they escape. It’s a tremendous curiosity that has fallen into a surprising lack of notoriety. Highlights: A giant cat fight in a courtyard between the two rival camps of prisoners– perhaps the biggest cat fight in cinema history. a bizarre, non-sensical ending in a hospital that I still don’t understand and can’t really describe. The homophobic disco sequence (an oxymoron?) in which the villain hits on the “hero.”","Pasha (as Leung Poeh)","","","贝如花","朱铁和","",""
"陆小凤之决战前后","1981","1759102","动作","武侠","古装","6.6","陆小凤(刘永饰)忽闻当代两大剑客叶孤城(白彪饰)与西门吹雪(岳华饰)，将于月圆之夜在紫禁城决斗；陆小凤忖度两人均是识英雄重英雄之辈，素末谋面，现 无利益冲突，当无决斗的必要，觉得这事其中必有跷蹊，与花满楼(孙建饰)及司空摘星等好友研究未果后，决定重 金买消息并前往京城调查清楚，不料传闻传出西门吹雪将决战押后一个月的信息……","楚原","","","白彪","刘永","岳华","艾飞"
"碧血剑","1981","1303835","剧情","动作","武侠","6.7","故事发生在明朝末年，袁承志（郭追 饰）是忠诚袁承焕（魏添财 饰）的儿子，在父子横死之后，袁承志由仆人带领，逃亡至华山，成为了华山派掌门人穆人清（李寿祺 饰）的弟子。一次偶然中，袁承志于一个山洞内发现了武林传奇金蛇郎君（龙天翔 饰）的遗骨，亦发现了失传已久的金蛇秘籍，就此练就了金蛇剑法。\n为了完成金蛇郎君的遗愿，袁承志踏上旅途寻找名为温仪（井莉 饰）的女子，又在途中结识了温青青（文雪儿 饰），袁承志就此被卷入了一段横埂在几代人之间的爱恨情仇之中。让袁承志没有想到的是，温婉可人的温青青，其真实身份正是金蛇郎君的女儿。©豆瓣","张彻","","","郭追","文雪儿","江生","井莉"
"流氓千王","1981","2136180","剧情","动作","","5.7","本片为程刚在1981年编导之赌片. 宗华与李修贤饰赌术精湛的流氓千王，李在澳门赌场被陈萍饰的千后击倒后，遂回港与宗密谋一雪其耻, 出千骗财, 开设豪华赌场, 欲将陈诱得入局...","程刚","","","李修贤","宗华","陈萍","艾飞"
"线人","1981","20284869","悬疑","犯罪","","0","青年吕良，本性善良又聪颖过人，但由于从小就失去双亲，疏于管教，遂结交损友，误入歧途，犯案累累，导致入狱服刑。\n刑满出狱后的吕良，得到警方特别罪案调查组督察张民的劝导，吕良决心改邪归正，为了报答张民的关怀，凡张民遇上辣手案件，吕良便暗中替其明查暗访，找寻线索，使张民能够迅速破案立功，这样不知不觉中吕良竟成了警方的线人。\n不法歹徒有计划行劫日藉游客，还意图杀死导游及司机，张民接到命令后与凶杀组联合调查，但四处努力侦查仍不得要领，吕良知悉一切，决心再助张民一臂之力","林义雄","","","任达华","柳影红","田丰",""
"老鼠街","1981","4824787","动作","喜剧","","5.7","手车夫李生、小偷阿东及马超为结义兄弟。一日，司令王维忠之子阿积设宴，李生三人往当杂工。饮宴之际，运输署长至，询问有关储备金之运送事宜，三人起夺金之念。王维忠为人奸狡，暗使管家祥伯派人假意夺金，并杀运输署长，不料三人棋先一著，王司令以为三人乃祥伯指使，不以为意，见三人不杀署长，唯有亲自下手杀之……","冯克安","罗棋","","刘家勇","冯克安","李海生","孟超"
"撞板神探电子龟","1981","4306473","喜剧","犯罪","","0","","黄志","","","乔宏","陈国新","林芳",""
"阿灿有难","1981","5374363","剧情","","","0","","李荣章","林国翔","","廖伟雄","米雪","",""
